no	time		source		destination	protocol length  info 	

14	14.741819	192.168.43.245	185.166.104.4	TCP	66	5003 → 443 [SYN] Seq=0 Win=64240 Len=0 MSS=1460 WS=256 SACK_PERM
15	14.779037	185.166.104.4	192.168.43.245	TCP	66	443 → 5003 [SYN, ACK] Seq=0 Ack=1 Win=42300 Len=0 MSS=1400 SACK_PERM WS=512
16	14.779262	192.168.43.245	185.166.104.4	TCP	54	5003 → 443 [ACK] Seq=1 Ack=1 Win=65792 Len=0
17	14.780430	192.168.43.245	185.166.104.4	TCP	1454	5003 → 443 [ACK] Seq=1 Ack=1 Win=65792 Len=1400 [TCP PDU reassembled in 18]
18	14.780430	192.168.43.245	185.166.104.4	TLSv1.3	377	Client Hello (SNI=www.zoomit.ir)
19	14.840520	185.166.104.4	192.168.43.245	TCP	54	443 → 5003 [ACK] Seq=1 Ack=1401 Win=42496 Len=0
20	14.840520	185.166.104.4	192.168.43.245	TCP	54	443 → 5003 [ACK] Seq=1 Ack=1724 Win=42496 Len=0
21	14.859993	185.166.104.4	192.168.43.245	TLSv1.3	1454	Server Hello, Change Cipher Spec, Application Data
22	14.859993	185.166.104.4	192.168.43.245	TCP	1454	443 → 5003 [PSH, ACK] Seq=1401 Ack=1724 Win=42496 Len=1400 [TCP PDU reassembled in 24]
23	14.860171	192.168.43.245	185.166.104.4	TCP	54	5003 → 443 [ACK] Seq=1724 Ack=2801 Win=65792 Len=0
24	14.860524	185.166.104.4	192.168.43.245	TLSv1.3	897	Application Data, Application Data, Application Data
25	14.864074	192.168.43.245	185.166.104.4	TLSv1.3	134	Change Cipher Spec, Application Data
26	14.864361	192.168.43.245	185.166.104.4	TLSv1.3	146	Application Data
27	14.864678	192.168.43.245	185.166.104.4	TLSv1.3	943	Application Data
28	14.897584	185.166.104.4	192.168.43.245	TLSv1.3	133	Application Data
29	14.898091	185.166.104.4	192.168.43.245	TLSv1.3	133	Application Data
30	14.898116	192.168.43.245	185.166.104.4	TCP	54	5003 → 443 [ACK] Seq=2785 Ack=3802 Win=64768 Len=0
31	14.898856	185.166.104.4	192.168.43.245	TLSv1.3	116	Application Data
32	14.898856	185.166.104.4	192.168.43.245	TLSv1.3	85	Application Data
33	14.898887	192.168.43.245	185.166.104.4	TCP	54	5003 → 443 [ACK] Seq=2785 Ack=3895 Win=64512 Len=0
34	14.898967	192.168.43.245	185.166.104.4	TLSv1.3	85	Application Data
35	14.900801	185.166.104.4	192.168.43.245	TCP	54	443 → 5003 [ACK] Seq=3864 Ack=2785 Win=42496 Len=0
36	14.900819	192.168.43.245	185.166.104.4	TCP	54	[TCP Dup ACK 33#1] 5003 → 443 [ACK] Seq=2816 Ack=3895 Win=64512 Len=0
37	14.907498	185.166.104.4	192.168.43.245	TCP	1454	443 → 5003 [ACK] Seq=3895 Ack=2785 Win=42496 Len=1400 [TCP PDU reassembled in 41]
38	14.907538	192.168.43.245	185.166.104.4	TCP	54	5003 → 443 [ACK] Seq=2816 Ack=5295 Win=65792 Len=0
39	14.907752	185.166.104.4	192.168.43.245	TCP	1454	443 → 5003 [PSH, ACK] Seq=5295 Ack=2785 Win=42496 Len=1400 [TCP PDU reassembled in 41]
40	14.907777	192.168.43.245	185.166.104.4	TCP	54	5003 → 443 [ACK] Seq=2816 Ack=6695 Win=65792 Len=0
41	14.909885	185.166.104.4	192.168.43.245	TLSv1.3	1372	Application Data
42	14.918857	185.166.104.4	192.168.43.245	TCP	1454	443 → 5003 [ACK] Seq=8013 Ack=2785 Win=42496 Len=1400 [TCP PDU reassembled in 45]
43	14.918857	185.166.104.4	192.168.43.245	TCP	1454	443 → 5003 [PSH, ACK] Seq=9413 Ack=2785 Win=42496 Len=1400 [TCP PDU reassembled in 45]
44	14.918933	192.168.43.245	185.166.104.4	TCP	54	5003 → 443 [ACK] Seq=2816 Ack=10813 Win=65792 Len=0
45	14.920215	185.166.104.4	192.168.43.245	TLSv1.3	1454	Application Data
46	14.920215	185.166.104.4	192.168.43.245	TCP	1454	443 → 5003 [PSH, ACK] Seq=12213 Ack=2785 Win=42496 Len=1400 [TCP PDU reassembled in 49]
47	14.920309	192.168.43.245	185.166.104.4	TCP	54	5003 → 443 [ACK] Seq=2816 Ack=13613 Win=65792 Len=0
48	14.922414	185.166.104.4	192.168.43.245	TCP	1454	443 → 5003 [ACK] Seq=13613 Ack=2785 Win=42496 Len=1400 [TCP PDU reassembled in 49]
49	14.922414	185.166.104.4	192.168.43.245	TLSv1.3	1454	Application Data
50	14.922480	192.168.43.245	185.166.104.4	TCP	54	5003 → 443 [ACK] Seq=2816 Ack=16413 Win=65792 Len=0
51	14.945733	185.166.104.4	192.168.43.245	TCP	1454	443 → 5003 [ACK] Seq=16413 Ack=2785 Win=42496 Len=1400 [TCP PDU reassembled in 55]
52	14.945874	192.168.43.245	185.166.104.4	TCP	54	5003 → 443 [ACK] Seq=2816 Ack=17813 Win=65792 Len=0
53	14.946129	185.166.104.4	192.168.43.245	TCP	1454	443 → 5003 [PSH, ACK] Seq=17813 Ack=2785 Win=42496 Len=1400 [TCP PDU reassembled in 55]
54	14.946207	192.168.43.245	185.166.104.4	TCP	54	5003 → 443 [ACK] Seq=2816 Ack=19213 Win=65792 Len=0
55	14.948194	185.166.104.4	192.168.43.245	TLSv1.3	1454	Application Data
56	14.948355	192.168.43.245	185.166.104.4	TCP	54	5003 → 443 [ACK] Seq=2816 Ack=20613 Win=65792 Len=0
57	14.948490	185.166.104.4	192.168.43.245	TCP	1454	443 → 5003 [PSH, ACK] Seq=20613 Ack=2785 Win=42496 Len=1400 [TCP PDU reassembled in 61]
58	14.948578	192.168.43.245	185.166.104.4	TCP	54	5003 → 443 [ACK] Seq=2816 Ack=22013 Win=65792 Len=0
59	14.952228	185.166.104.4	192.168.43.245	TCP	1454	443 → 5003 [ACK] Seq=22013 Ack=2816 Win=42496 Len=1400 [TCP PDU reassembled in 61]
60	14.952410	192.168.43.245	185.166.104.4	TCP	54	5003 → 443 [ACK] Seq=2816 Ack=23413 Win=65792 Len=0
61	14.952644	185.166.104.4	192.168.43.245	TLSv1.3	1454	Application Data
62	14.956372	185.166.104.4	192.168.43.245	TCP	1454	443 → 5003 [ACK] Seq=24813 Ack=2816 Win=42496 Len=1400 [TCP PDU reassembled in 65]
63	14.956606	192.168.43.245	185.166.104.4	TCP	54	5003 → 443 [ACK] Seq=2816 Ack=26213 Win=65792 Len=0
64	14.956768	185.166.104.4	192.168.43.245	TCP	1454	443 → 5003 [PSH, ACK] Seq=26213 Ack=2816 Win=42496 Len=1400 [TCP PDU reassembled in 65]
65	14.957565	185.166.104.4	192.168.43.245	TLSv1.3	1454	Application Data
66	14.957729	192.168.43.245	185.166.104.4	TCP	54	5003 → 443 [ACK] Seq=2816 Ack=29013 Win=65792 Len=0
67	14.957874	185.166.104.4	192.168.43.245	TCP	1454	443 → 5003 [PSH, ACK] Seq=29013 Ack=2816 Win=42496 Len=1400 [TCP PDU reassembled in 70]
68	14.960398	185.166.104.4	192.168.43.245	TCP	1454	443 → 5003 [ACK] Seq=30413 Ack=2816 Win=42496 Len=1400 [TCP PDU reassembled in 70]
69	14.960505	192.168.43.245	185.166.104.4	TCP	54	5003 → 443 [ACK] Seq=2816 Ack=31813 Win=65792 Len=0
70	14.960630	185.166.104.4	192.168.43.245	TLSv1.3	1454	Application Data
71	14.965499	185.166.104.4	192.168.43.245	TCP	1454	443 → 5003 [ACK] Seq=33213 Ack=2816 Win=42496 Len=1400 [TCP PDU reassembled in 74]
72	14.965631	192.168.43.245	185.166.104.4	TCP	54	5003 → 443 [ACK] Seq=2816 Ack=34613 Win=65792 Len=0
73	14.965778	185.166.104.4	192.168.43.245	TCP	1454	443 → 5003 [PSH, ACK] Seq=34613 Ack=2816 Win=42496 Len=1400 [TCP PDU reassembled in 74]
74	14.979698	185.166.104.4	192.168.43.245	TLSv1.3	1454	Application Data
75	14.979762	192.168.43.245	185.166.104.4	TCP	54	5003 → 443 [ACK] Seq=2816 Ack=37413 Win=65792 Len=0
76	14.979950	185.166.104.4	192.168.43.245	TCP	1454	443 → 5003 [PSH, ACK] Seq=37413 Ack=2816 Win=42496 Len=1400 [TCP PDU reassembled in 79]
77	14.982350	185.166.104.4	192.168.43.245	TCP	1454	443 → 5003 [ACK] Seq=38813 Ack=2816 Win=42496 Len=1400 [TCP PDU reassembled in 79]
78	14.982402	192.168.43.245	185.166.104.4	TCP	54	5003 → 443 [ACK] Seq=2816 Ack=40213 Win=65792 Len=0
79	14.982578	185.166.104.4	192.168.43.245	TLSv1.3	1454	Application Data, Application Data
80	14.983623	185.166.104.4	192.168.43.245	TCP	1454	443 → 5003 [ACK] Seq=41613 Ack=2816 Win=42496 Len=1400 [TCP PDU reassembled in 83]
81	14.983623	185.166.104.4	192.168.43.245	TCP	1454	443 → 5003 [PSH, ACK] Seq=43013 Ack=2816 Win=42496 Len=1400 [TCP PDU reassembled in 83]
82	14.983701	192.168.43.245	185.166.104.4	TCP	54	5003 → 443 [ACK] Seq=2816 Ack=44413 Win=65792 Len=0
83	14.998712	185.166.104.4	192.168.43.245	TLSv1.3	1454	Application Data
84	14.998771	192.168.43.245	185.166.104.4	TCP	54	5003 → 443 [ACK] Seq=2816 Ack=45813 Win=65792 Len=0
85	14.999004	185.166.104.4	192.168.43.245	TCP	1454	443 → 5003 [PSH, ACK] Seq=45813 Ack=2816 Win=42496 Len=1400 [TCP PDU reassembled in 88]
86	15.000161	185.166.104.4	192.168.43.245	TCP	1454	443 → 5003 [ACK] Seq=47213 Ack=2816 Win=42496 Len=1400 [TCP PDU reassembled in 88]
87	15.000239	192.168.43.245	185.166.104.4	TCP	54	5003 → 443 [ACK] Seq=2816 Ack=48613 Win=65792 Len=0
88	15.001867	185.166.104.4	192.168.43.245	TLSv1.3	1454	Application Data
89	15.002203	185.166.104.4	192.168.43.245	TCP	1454	443 → 5003 [PSH, ACK] Seq=50013 Ack=2816 Win=42496 Len=1400 [TCP PDU reassembled in 92]
90	15.002283	192.168.43.245	185.166.104.4	TCP	54	5003 → 443 [ACK] Seq=2816 Ack=51413 Win=65792 Len=0
92	15.003010	185.166.104.4	192.168.43.245	TLSv1.3	1454	Application Data
94	15.003162	185.166.104.4	192.168.43.245	TCP	1454	443 → 5003 [PSH, ACK] Seq=52813 Ack=2816 Win=42496 Len=1400 [TCP PDU reassembled in 97]
95	15.003192	192.168.43.245	185.166.104.4	TCP	54	5003 → 443 [ACK] Seq=2816 Ack=54213 Win=65792 Len=0
96	15.005122	185.166.104.4	192.168.43.245	TCP	1454	443 → 5003 [ACK] Seq=54213 Ack=2816 Win=42496 Len=1400 [TCP PDU reassembled in 97]
97	15.005528	185.166.104.4	192.168.43.245	TLSv1.3	1454	Application Data
98	15.005566	192.168.43.245	185.166.104.4	TCP	54	5003 → 443 [ACK] Seq=2816 Ack=57013 Win=65792 Len=0
99	15.007284	185.166.104.4	192.168.43.245	TCP	1454	443 → 5003 [ACK] Seq=57013 Ack=2816 Win=42496 Len=1400 [TCP PDU reassembled in 102]
100	15.007948	185.166.104.4	192.168.43.245	TCP	1454	443 → 5003 [PSH, ACK] Seq=58413 Ack=2816 Win=42496 Len=1400 [TCP PDU reassembled in 102]
101	15.007979	192.168.43.245	185.166.104.4	TCP	54	5003 → 443 [ACK] Seq=2816 Ack=59813 Win=65792 Len=0
102	15.008924	185.166.104.4	192.168.43.245	TLSv1.3	1454	Application Data
103	15.008924	185.166.104.4	192.168.43.245	TCP	1454	443 → 5003 [PSH, ACK] Seq=61213 Ack=2816 Win=42496 Len=1400 [TCP PDU reassembled in 106]
104	15.008957	192.168.43.245	185.166.104.4	TCP	54	5003 → 443 [ACK] Seq=2816 Ack=62613 Win=65792 Len=0
105	15.015272	185.166.104.4	192.168.43.245	TCP	1454	443 → 5003 [ACK] Seq=62613 Ack=2816 Win=42496 Len=1400 [TCP PDU reassembled in 106]
106	15.017859	185.166.104.4	192.168.43.245	TLSv1.3	1454	Application Data
107	15.017923	192.168.43.245	185.166.104.4	TCP	54	5003 → 443 [ACK] Seq=2816 Ack=65413 Win=65792 Len=0
108	15.018820	185.166.104.4	192.168.43.245	TCP	1454	443 → 5003 [ACK] Seq=65413 Ack=2816 Win=42496 Len=1400 [TCP PDU reassembled in 111]
109	15.019784	185.166.104.4	192.168.43.245	TCP	1454	443 → 5003 [PSH, ACK] Seq=66813 Ack=2816 Win=42496 Len=1400 [TCP PDU reassembled in 111]
110	15.019805	192.168.43.245	185.166.104.4	TCP	54	5003 → 443 [ACK] Seq=2816 Ack=68213 Win=65792 Len=0
111	15.019826	185.166.104.4	192.168.43.245	TLSv1.3	1454	Application Data
112	15.019986	185.166.104.4	192.168.43.245	TCP	1454	443 → 5003 [PSH, ACK] Seq=69613 Ack=2816 Win=42496 Len=1400 [TCP PDU reassembled in 115]
113	15.020003	192.168.43.245	185.166.104.4	TCP	54	5003 → 443 [ACK] Seq=2816 Ack=71013 Win=65792 Len=0
114	15.020158	185.166.104.4	192.168.43.245	TCP	1454	443 → 5003 [ACK] Seq=71013 Ack=2816 Win=42496 Len=1400 [TCP PDU reassembled in 115]
115	15.020313	185.166.104.4	192.168.43.245	TLSv1.3	1454	Application Data
116	15.020334	192.168.43.245	185.166.104.4	TCP	54	5003 → 443 [ACK] Seq=2816 Ack=73813 Win=65792 Len=0
117	15.020699	185.166.104.4	192.168.43.245	TCP	1454	443 → 5003 [ACK] Seq=73813 Ack=2816 Win=42496 Len=1400 [TCP PDU reassembled in 119]
118	15.021831	185.166.104.4	192.168.43.245	TCP	1454	443 → 5003 [PSH, ACK] Seq=75213 Ack=2816 Win=42496 Len=1400 [TCP PDU reassembled in 119]
119	15.021831	185.166.104.4	192.168.43.245	TLSv1.3	1454	Application Data
120	15.021854	192.168.43.245	185.166.104.4	TCP	54	5003 → 443 [ACK] Seq=2816 Ack=78013 Win=65792 Len=0
121	15.024167	185.166.104.4	192.168.43.245	TCP	1454	443 → 5003 [PSH, ACK] Seq=78013 Ack=2816 Win=42496 Len=1400 [TCP PDU reassembled in 124]
122	15.024219	192.168.43.245	185.166.104.4	TCP	54	5003 → 443 [ACK] Seq=2816 Ack=79413 Win=65792 Len=0
123	15.024352	185.166.104.4	192.168.43.245	TCP	1454	443 → 5003 [PSH, ACK] Seq=79413 Ack=2816 Win=42496 Len=1400 [TCP PDU reassembled in 124]
124	15.025752	185.166.104.4	192.168.43.245	TLSv1.3	1454	Application Data
125	15.025752	185.166.104.4	192.168.43.245	TCP	1454	443 → 5003 [PSH, ACK] Seq=82213 Ack=2816 Win=42496 Len=1400 [TCP PDU reassembled in 129]
126	15.025792	192.168.43.245	185.166.104.4	TCP	54	5003 → 443 [ACK] Seq=2816 Ack=83613 Win=65792 Len=0
127	15.025905	185.166.104.4	192.168.43.245	TCP	1454	443 → 5003 [ACK] Seq=83613 Ack=2816 Win=42496 Len=1400 [TCP PDU reassembled in 129]
128	15.025932	192.168.43.245	185.166.104.4	TCP	54	5003 → 443 [ACK] Seq=2816 Ack=85013 Win=65792 Len=0
129	15.026085	185.166.104.4	192.168.43.245	TLSv1.3	1454	Application Data
130	15.026240	185.166.104.4	192.168.43.245	TCP	1454	443 → 5003 [ACK] Seq=86413 Ack=2816 Win=42496 Len=1400 [TCP PDU reassembled in 133]
131	15.026265	192.168.43.245	185.166.104.4	TCP	54	5003 → 443 [ACK] Seq=2816 Ack=87813 Win=65792 Len=0
132	15.026397	185.166.104.4	192.168.43.245	TCP	1454	443 → 5003 [PSH, ACK] Seq=87813 Ack=2816 Win=42496 Len=1400 [TCP PDU reassembled in 133]
133	15.032027	185.166.104.4	192.168.43.245	TLSv1.3	1454	Application Data
134	15.032147	192.168.43.245	185.166.104.4	TCP	54	5003 → 443 [ACK] Seq=2816 Ack=90613 Win=65792 Len=0
135	15.032307	185.166.104.4	192.168.43.245	TCP	1454	443 → 5003 [PSH, ACK] Seq=90613 Ack=2816 Win=42496 Len=1400 [TCP PDU reassembled in 137]
136	15.033114	185.166.104.4	192.168.43.245	TCP	1454	443 → 5003 [ACK] Seq=92013 Ack=2816 Win=42496 Len=1400 [TCP PDU reassembled in 137]
137	15.033114	185.166.104.4	192.168.43.245	TLSv1.3	1454	Application Data
138	15.033198	192.168.43.245	185.166.104.4	TCP	54	5003 → 443 [ACK] Seq=2816 Ack=94813 Win=65792 Len=0
139	15.052571	185.166.104.4	192.168.43.245	TCP	1454	443 → 5003 [ACK] Seq=94813 Ack=2816 Win=42496 Len=1400 [TCP PDU reassembled in 141]
140	15.052624	192.168.43.245	185.166.104.4	TCP	54	5003 → 443 [ACK] Seq=2816 Ack=96213 Win=65792 Len=0
141	15.053300	185.166.104.4	192.168.43.245	TLSv1.3	1156	Application Data
144	15.055608	192.168.43.245	185.166.104.4	TLSv1.3	257	Application Data
145	15.055651	192.168.43.245	185.166.104.4	TLSv1.3	161	Application Data
146	15.101660	185.166.104.4	192.168.43.245	TCP	54	443 → 5003 [ACK] Seq=97315 Ack=3126 Win=42496 Len=0
147	15.104580	185.166.104.4	192.168.43.245	TCP	1454	443 → 5003 [ACK] Seq=97315 Ack=3126 Win=42496 Len=1400 [TCP PDU reassembled in 150]
148	15.105175	185.166.104.4	192.168.43.245	TCP	1454	443 → 5003 [PSH, ACK] Seq=98715 Ack=3126 Win=42496 Len=1400 [TCP PDU reassembled in 150]
149	15.105205	192.168.43.245	185.166.104.4	TCP	54	5003 → 443 [ACK] Seq=3126 Ack=100115 Win=65792 Len=0
150	15.106380	185.166.104.4	192.168.43.245	TLSv1.3	1372	Application Data
151	15.106380	185.166.104.4	192.168.43.245	TCP	1454	443 → 5003 [ACK] Seq=101433 Ack=3126 Win=42496 Len=1400 [TCP PDU reassembled in 154]
152	15.106429	192.168.43.245	185.166.104.4	TCP	54	5003 → 443 [ACK] Seq=3126 Ack=102833 Win=65792 Len=0
153	15.106555	185.166.104.4	192.168.43.245	TCP	1454	443 → 5003 [PSH, ACK] Seq=102833 Ack=3126 Win=42496 Len=1400 [TCP PDU reassembled in 154]
154	15.106705	185.166.104.4	192.168.43.245	TLSv1.3	1454	Application Data
155	15.106738	192.168.43.245	185.166.104.4	TCP	54	5003 → 443 [ACK] Seq=3126 Ack=105633 Win=65792 Len=0
156	15.106883	185.166.104.4	192.168.43.245	TCP	1454	443 → 5003 [PSH, ACK] Seq=105633 Ack=3126 Win=42496 Len=1400 [TCP PDU reassembled in 159]
157	15.107921	185.166.104.4	192.168.43.245	TCP	1454	443 → 5003 [ACK] Seq=107033 Ack=3126 Win=42496 Len=1400 [TCP PDU reassembled in 159]
158	15.107974	192.168.43.245	185.166.104.4	TCP	54	5003 → 443 [ACK] Seq=3126 Ack=108433 Win=65792 Len=0
159	15.108295	185.166.104.4	192.168.43.245	TLSv1.3	1454	Application Data
160	15.120148	185.166.104.4	192.168.43.245	TCP	1454	443 → 5003 [ACK] Seq=109833 Ack=3126 Win=42496 Len=1400 [TCP PDU reassembled in 163]
161	15.120202	192.168.43.245	185.166.104.4	TCP	54	5003 → 443 [ACK] Seq=3126 Ack=111233 Win=65792 Len=0
162	15.120460	185.166.104.4	192.168.43.245	TCP	1454	443 → 5003 [PSH, ACK] Seq=111233 Ack=3126 Win=42496 Len=1400 [TCP PDU reassembled in 163]
163	15.122071	185.166.104.4	192.168.43.245	TLSv1.3	1454	Application Data
164	15.122071	185.166.104.4	192.168.43.245	TCP	1454	443 → 5003 [PSH, ACK] Seq=114033 Ack=3126 Win=42496 Len=1400 [TCP PDU reassembled in 168]
165	15.122120	192.168.43.245	185.166.104.4	TCP	54	5003 → 443 [ACK] Seq=3126 Ack=115433 Win=65792 Len=0
166	15.122250	185.166.104.4	192.168.43.245	TCP	1454	443 → 5003 [ACK] Seq=115433 Ack=3126 Win=42496 Len=1400 [TCP PDU reassembled in 168]
167	15.122271	192.168.43.245	185.166.104.4	TCP	54	5003 → 443 [ACK] Seq=3126 Ack=116833 Win=65792 Len=0
168	15.122407	185.166.104.4	192.168.43.245	TLSv1.3	1454	Application Data
169	15.123457	185.166.104.4	192.168.43.245	TCP	1454	443 → 5003 [ACK] Seq=118233 Ack=3126 Win=42496 Len=1400 [TCP PDU reassembled in 172]
170	15.123487	192.168.43.245	185.166.104.4	TCP	54	5003 → 443 [ACK] Seq=3126 Ack=119633 Win=65792 Len=0
171	15.125192	185.166.104.4	192.168.43.245	TCP	1454	443 → 5003 [PSH, ACK] Seq=119633 Ack=3126 Win=42496 Len=1400 [TCP PDU reassembled in 172]
172	15.125192	185.166.104.4	192.168.43.245	TLSv1.3	1454	Application Data
173	15.125234	192.168.43.245	185.166.104.4	TCP	54	5003 → 443 [ACK] Seq=3126 Ack=122433 Win=65792 Len=0
174	15.125409	185.166.104.4	192.168.43.245	TCP	1454	443 → 5003 [PSH, ACK] Seq=122433 Ack=3126 Win=42496 Len=1400 [TCP PDU reassembled in 177]
175	15.125515	185.166.104.4	192.168.43.245	TCP	1454	443 → 5003 [ACK] Seq=123833 Ack=3126 Win=42496 Len=1400 [TCP PDU reassembled in 177]
176	15.125535	192.168.43.245	185.166.104.4	TCP	54	5003 → 443 [ACK] Seq=3126 Ack=125233 Win=65792 Len=0
177	15.125682	185.166.104.4	192.168.43.245	TLSv1.3	1454	Application Data
178	15.125835	185.166.104.4	192.168.43.245	TCP	1454	443 → 5003 [ACK] Seq=126633 Ack=3126 Win=42496 Len=1400 [TCP PDU reassembled in 181]
179	15.125852	192.168.43.245	185.166.104.4	TCP	54	5003 → 443 [ACK] Seq=3126 Ack=128033 Win=65792 Len=0
180	15.126016	185.166.104.4	192.168.43.245	TCP	1454	443 → 5003 [PSH, ACK] Seq=128033 Ack=3126 Win=42496 Len=1400 [TCP PDU reassembled in 181]
181	15.126171	185.166.104.4	192.168.43.245	TLSv1.3	1454	Application Data
182	15.126185	192.168.43.245	185.166.104.4	TCP	54	5003 → 443 [ACK] Seq=3126 Ack=130833 Win=65792 Len=0
183	15.126326	185.166.104.4	192.168.43.245	TCP	1454	443 → 5003 [PSH, ACK] Seq=130833 Ack=3126 Win=42496 Len=1400 [TCP PDU reassembled in 186]
184	15.127182	185.166.104.4	192.168.43.245	TCP	1454	443 → 5003 [ACK] Seq=132233 Ack=3126 Win=42496 Len=1400 [TCP PDU reassembled in 186]
185	15.127205	192.168.43.245	185.166.104.4	TCP	54	5003 → 443 [ACK] Seq=3126 Ack=133633 Win=65792 Len=0
186	15.131723	185.166.104.4	192.168.43.245	TLSv1.3	1454	Application Data
187	15.132171	185.166.104.4	192.168.43.245	TCP	1454	443 → 5003 [ACK] Seq=135033 Ack=3126 Win=42496 Len=1400 [TCP PDU reassembled in 190]
188	15.132210	192.168.43.245	185.166.104.4	TCP	54	5003 → 443 [ACK] Seq=3126 Ack=136433 Win=131584 Len=0
189	15.136045	185.166.104.4	192.168.43.245	TCP	1454	443 → 5003 [PSH, ACK] Seq=136433 Ack=3126 Win=42496 Len=1400 [TCP PDU reassembled in 190]
190	15.140613	185.166.104.4	192.168.43.245	TLSv1.3	1454	Application Data
191	15.140663	192.168.43.245	185.166.104.4	TCP	54	5003 → 443 [ACK] Seq=3126 Ack=139233 Win=131584 Len=0
192	15.140993	185.166.104.4	192.168.43.245	TCP	1454	443 → 5003 [PSH, ACK] Seq=139233 Ack=3126 Win=42496 Len=1400 [TCP PDU reassembled in 195]
193	15.142745	185.166.104.4	192.168.43.245	TCP	1454	443 → 5003 [ACK] Seq=140633 Ack=3126 Win=42496 Len=1400 [TCP PDU reassembled in 195]
194	15.142795	192.168.43.245	185.166.104.4	TCP	54	5003 → 443 [ACK] Seq=3126 Ack=142033 Win=131584 Len=0
195	15.143004	185.166.104.4	192.168.43.245	TLSv1.3	1454	Application Data
196	15.150606	185.166.104.4	192.168.43.245	TCP	1454	443 → 5003 [PSH, ACK] Seq=143433 Ack=3126 Win=42496 Len=1400 [TCP PDU reassembled in 199]
197	15.150662	192.168.43.245	185.166.104.4	TCP	54	5003 → 443 [ACK] Seq=3126 Ack=144833 Win=131584 Len=0
198	15.187790	185.166.104.4	192.168.43.245	TCP	1454	443 → 5003 [ACK] Seq=144833 Ack=3126 Win=42496 Len=1400 [TCP PDU reassembled in 199]
199	15.199186	185.166.104.4	192.168.43.245	TLSv1.3	1454	Application Data
200	15.199234	192.168.43.245	185.166.104.4	TCP	54	5003 → 443 [ACK] Seq=3126 Ack=147633 Win=131584 Len=0
201	15.199472	185.166.104.4	192.168.43.245	TCP	1454	443 → 5003 [ACK] Seq=147633 Ack=3126 Win=42496 Len=1400 [TCP PDU reassembled in 203]
202	15.201012	185.166.104.4	192.168.43.245	TCP	1454	443 → 5003 [PSH, ACK] Seq=149033 Ack=3126 Win=42496 Len=1400 [TCP PDU reassembled in 203]
203	15.201012	185.166.104.4	192.168.43.245	TLSv1.3	1454	Application Data
204	15.201057	192.168.43.245	185.166.104.4	TCP	54	5003 → 443 [ACK] Seq=3126 Ack=151833 Win=131584 Len=0
205	15.201252	185.166.104.4	192.168.43.245	TCP	1454	443 → 5003 [PSH, ACK] Seq=151833 Ack=3126 Win=42496 Len=1400 [TCP PDU reassembled in 208]
206	15.201284	192.168.43.245	185.166.104.4	TCP	54	5003 → 443 [ACK] Seq=3126 Ack=153233 Win=131584 Len=0
207	15.201340	185.166.104.4	192.168.43.245	TCP	1454	443 → 5003 [ACK] Seq=153233 Ack=3126 Win=42496 Len=1400 [TCP PDU reassembled in 208]
208	15.201493	185.166.104.4	192.168.43.245	TLSv1.3	1454	Application Data
209	15.201517	192.168.43.245	185.166.104.4	TCP	54	5003 → 443 [ACK] Seq=3126 Ack=156033 Win=131584 Len=0
210	15.202689	185.166.104.4	192.168.43.245	TCP	1454	443 → 5003 [ACK] Seq=156033 Ack=3126 Win=42496 Len=1400 [TCP PDU reassembled in 213]
211	15.204093	185.166.104.4	192.168.43.245	TCP	1454	443 → 5003 [PSH, ACK] Seq=157433 Ack=3126 Win=42496 Len=1400 [TCP PDU reassembled in 213]
212	15.204137	192.168.43.245	185.166.104.4	TCP	54	5003 → 443 [ACK] Seq=3126 Ack=158833 Win=131584 Len=0
213	15.204299	185.166.104.4	192.168.43.245	TLSv1.3	1454	Application Data
214	15.205353	185.166.104.4	192.168.43.245	TCP	1454	443 → 5003 [PSH, ACK] Seq=160233 Ack=3126 Win=42496 Len=1400 [TCP PDU reassembled in 217]
215	15.205394	192.168.43.245	185.166.104.4	TCP	54	5003 → 443 [ACK] Seq=3126 Ack=161633 Win=131584 Len=0
216	15.210640	185.166.104.4	192.168.43.245	TCP	1454	443 → 5003 [ACK] Seq=161633 Ack=3126 Win=42496 Len=1400 [TCP PDU reassembled in 217]
217	15.211238	185.166.104.4	192.168.43.245	TLSv1.3	1454	Application Data
218	15.211270	192.168.43.245	185.166.104.4	TCP	54	5003 → 443 [ACK] Seq=3126 Ack=164433 Win=131584 Len=0
219	15.218429	185.166.104.4	192.168.43.245	TCP	1454	443 → 5003 [ACK] Seq=164433 Ack=3126 Win=42496 Len=1400 [TCP PDU reassembled in 222]
220	15.218979	185.166.104.4	192.168.43.245	TCP	1454	443 → 5003 [PSH, ACK] Seq=165833 Ack=3126 Win=42496 Len=1400 [TCP PDU reassembled in 222]
221	15.219013	192.168.43.245	185.166.104.4	TCP	54	5003 → 443 [ACK] Seq=3126 Ack=167233 Win=131584 Len=0
222	15.220431	185.166.104.4	192.168.43.245	TLSv1.3	1454	Application Data
223	15.221515	185.166.104.4	192.168.43.245	TCP	1454	443 → 5003 [PSH, ACK] Seq=168633 Ack=3126 Win=42496 Len=1400 [TCP PDU reassembled in 226]
224	15.221543	192.168.43.245	185.166.104.4	TCP	54	5003 → 443 [ACK] Seq=3126 Ack=170033 Win=131584 Len=0
225	15.222712	185.166.104.4	192.168.43.245	TCP	1454	443 → 5003 [ACK] Seq=170033 Ack=3126 Win=42496 Len=1400 [TCP PDU reassembled in 226]
226	15.236723	185.166.104.4	192.168.43.245	TLSv1.3	1454	Application Data
227	15.236770	192.168.43.245	185.166.104.4	TCP	54	5003 → 443 [ACK] Seq=3126 Ack=172833 Win=131584 Len=0
228	15.236886	185.166.104.4	192.168.43.245	TCP	1454	443 → 5003 [ACK] Seq=172833 Ack=3126 Win=42496 Len=1400 [TCP PDU reassembled in 229]
229	15.237813	185.166.104.4	192.168.43.245	TLSv1.3	1454	Application Data
230	15.237837	192.168.43.245	185.166.104.4	TCP	54	5003 → 443 [ACK] Seq=3126 Ack=175633 Win=131584 Len=0
231	15.246123	185.166.104.4	192.168.43.245	TCP	1454	443 → 5003 [PSH, ACK] Seq=175633 Ack=3126 Win=42496 Len=1400 [TCP PDU reassembled in 234]
232	15.247090	185.166.104.4	192.168.43.245	TCP	1454	443 → 5003 [ACK] Seq=177033 Ack=3126 Win=42496 Len=1400 [TCP PDU reassembled in 234]
233	15.247139	192.168.43.245	185.166.104.4	TCP	54	5003 → 443 [ACK] Seq=3126 Ack=178433 Win=131584 Len=0
234	15.248877	185.166.104.4	192.168.43.245	TLSv1.3	1454	Application Data
235	15.248920	185.166.104.4	192.168.43.245	TCP	1454	443 → 5003 [ACK] Seq=179833 Ack=3126 Win=42496 Len=1400 [TCP PDU reassembled in 238]
236	15.248939	192.168.43.245	185.166.104.4	TCP	54	5003 → 443 [ACK] Seq=3126 Ack=181233 Win=131584 Len=0
237	15.249075	185.166.104.4	192.168.43.245	TCP	1454	443 → 5003 [PSH, ACK] Seq=181233 Ack=3126 Win=42496 Len=1400 [TCP PDU reassembled in 238]
238	15.249245	185.166.104.4	192.168.43.245	TLSv1.3	1454	Application Data
239	15.249262	192.168.43.245	185.166.104.4	TCP	54	5003 → 443 [ACK] Seq=3126 Ack=184033 Win=131584 Len=0
240	15.249405	185.166.104.4	192.168.43.245	TCP	1454	443 → 5003 [PSH, ACK] Seq=184033 Ack=3126 Win=42496 Len=1400 [TCP PDU reassembled in 243]
241	15.249590	185.166.104.4	192.168.43.245	TCP	1454	443 → 5003 [ACK] Seq=185433 Ack=3126 Win=42496 Len=1400 [TCP PDU reassembled in 243]
242	15.249610	192.168.43.245	185.166.104.4	TCP	54	5003 → 443 [ACK] Seq=3126 Ack=186833 Win=131584 Len=0
243	15.249744	185.166.104.4	192.168.43.245	TLSv1.3	1454	Application Data
244	15.249946	185.166.104.4	192.168.43.245	TCP	1454	443 → 5003 [ACK] Seq=188233 Ack=3126 Win=42496 Len=1400 [TCP PDU reassembled in 247]
245	15.249971	192.168.43.245	185.166.104.4	TCP	54	5003 → 443 [ACK] Seq=3126 Ack=189633 Win=131584 Len=0
246	15.250066	185.166.104.4	192.168.43.245	TCP	1454	443 → 5003 [PSH, ACK] Seq=189633 Ack=3126 Win=42496 Len=1400 [TCP PDU reassembled in 247]
247	15.250223	185.166.104.4	192.168.43.245	TLSv1.3	1454	Application Data
248	15.250242	192.168.43.245	185.166.104.4	TCP	54	5003 → 443 [ACK] Seq=3126 Ack=192433 Win=131584 Len=0
249	15.250578	185.166.104.4	192.168.43.245	TCP	1454	443 → 5003 [PSH, ACK] Seq=192433 Ack=3126 Win=42496 Len=1400 [TCP PDU reassembled in 252]
250	15.251629	185.166.104.4	192.168.43.245	TCP	1454	443 → 5003 [ACK] Seq=193833 Ack=3126 Win=42496 Len=1400 [TCP PDU reassembled in 252]
251	15.251647	192.168.43.245	185.166.104.4	TCP	54	5003 → 443 [ACK] Seq=3126 Ack=195233 Win=131584 Len=0
252	15.259457	185.166.104.4	192.168.43.245	TLSv1.3	1454	Application Data
253	15.261284	185.166.104.4	192.168.43.245	TCP	1454	443 → 5003 [ACK] Seq=196633 Ack=3126 Win=42496 Len=1400 [TCP PDU reassembled in 256]
254	15.261355	192.168.43.245	185.166.104.4	TCP	54	5003 → 443 [ACK] Seq=3126 Ack=198033 Win=131584 Len=0
255	15.261598	185.166.104.4	192.168.43.245	TCP	1454	443 → 5003 [PSH, ACK] Seq=198033 Ack=3126 Win=42496 Len=1400 [TCP PDU reassembled in 256]
256	15.263717	185.166.104.4	192.168.43.245	TLSv1.3	1454	Application Data
257	15.263764	192.168.43.245	185.166.104.4	TCP	54	5003 → 443 [ACK] Seq=3126 Ack=200833 Win=131584 Len=0
258	15.264003	185.166.104.4	192.168.43.245	TCP	1454	443 → 5003 [PSH, ACK] Seq=200833 Ack=3126 Win=42496 Len=1400 [TCP PDU reassembled in 260]
259	15.265289	185.166.104.4	192.168.43.245	TCP	1454	443 → 5003 [ACK] Seq=202233 Ack=3126 Win=42496 Len=1400 [TCP PDU reassembled in 260]
260	15.265289	185.166.104.4	192.168.43.245	TLSv1.3	1454	Application Data
261	15.265325	192.168.43.245	185.166.104.4	TCP	54	5003 → 443 [ACK] Seq=3126 Ack=205033 Win=131584 Len=0
262	15.265434	185.166.104.4	192.168.43.245	TCP	1454	443 → 5003 [ACK] Seq=205033 Ack=3126 Win=42496 Len=1400 [TCP PDU reassembled in 265]
263	15.265455	192.168.43.245	185.166.104.4	TCP	54	5003 → 443 [ACK] Seq=3126 Ack=206433 Win=131584 Len=0
264	15.265610	185.166.104.4	192.168.43.245	TCP	1454	443 → 5003 [ACK] Seq=206433 Ack=3126 Win=42496 Len=1400 [TCP PDU reassembled in 265]
265	15.265740	185.166.104.4	192.168.43.245	TLSv1.3	1319	Application Data, Application Data
266	15.265763	192.168.43.245	185.166.104.4	TCP	54	5003 → 443 [ACK] Seq=3126 Ack=209098 Win=131584 Len=0
267	15.544217	192.168.43.245	185.166.104.4	TLSv1.3	206	Application Data
268	15.545751	192.168.43.245	185.166.104.4	TLSv1.3	166	Application Data
269	15.596460	185.166.104.4	192.168.43.245	TCP	54	443 → 5003 [ACK] Seq=209098 Ack=3390 Win=42496 Len=0
270	15.618180	185.166.104.4	192.168.43.245	TLSv1.3	705	Application Data
271	15.620858	185.166.104.4	192.168.43.245	TCP	1454	443 → 5003 [ACK] Seq=209749 Ack=3390 Win=42496 Len=1400 [TCP PDU reassembled in 275]
272	15.620913	192.168.43.245	185.166.104.4	TCP	54	5003 → 443 [ACK] Seq=3390 Ack=211149 Win=131584 Len=0
273	15.621310	185.166.104.4	192.168.43.245	TCP	1454	443 → 5003 [PSH, ACK] Seq=211149 Ack=3390 Win=42496 Len=1400 [TCP PDU reassembled in 275]
274	15.622392	192.168.43.245	185.166.104.4	TLSv1.3	151	Application Data
275	15.634355	185.166.104.4	192.168.43.245	TLSv1.3	1372	Application Data
276	15.634755	185.166.104.4	192.168.43.245	TCP	1454	443 → 5003 [ACK] Seq=213867 Ack=3390 Win=42496 Len=1400 [TCP PDU reassembled in 278]
277	15.634778	192.168.43.245	185.166.104.4	TCP	54	5003 → 443 [ACK] Seq=3487 Ack=215267 Win=131584 Len=0
278	15.635193	185.166.104.4	192.168.43.245	TLSv1.3	357	Application Data
279	15.635193	185.166.104.4	192.168.43.245	TLSv1.3	85	Application Data
280	15.635219	192.168.43.245	185.166.104.4	TCP	54	5003 → 443 [ACK] Seq=3487 Ack=215601 Win=131072 Len=0
281	15.703898	185.166.104.4	192.168.43.245	TCP	1454	443 → 5003 [ACK] Seq=215601 Ack=3487 Win=42496 Len=1400 [TCP PDU reassembled in 284]
282	15.703898	185.166.104.4	192.168.43.245	TCP	1454	443 → 5003 [PSH, ACK] Seq=217001 Ack=3487 Win=42496 Len=1400 [TCP PDU reassembled in 284]
283	15.704054	192.168.43.245	185.166.104.4	TCP	54	5003 → 443 [ACK] Seq=3487 Ack=218401 Win=131584 Len=0
284	15.704582	185.166.104.4	192.168.43.245	TLSv1.3	1372	Application Data
285	15.704582	185.166.104.4	192.168.43.245	TCP	1454	443 → 5003 [ACK] Seq=219719 Ack=3487 Win=42496 Len=1400 [TCP PDU reassembled in 288]
286	15.704735	192.168.43.245	185.166.104.4	TCP	54	5003 → 443 [ACK] Seq=3487 Ack=221119 Win=131584 Len=0
287	15.704894	185.166.104.4	192.168.43.245	TCP	1454	443 → 5003 [PSH, ACK] Seq=221119 Ack=3487 Win=42496 Len=1400 [TCP PDU reassembled in 288]
288	15.705669	185.166.104.4	192.168.43.245	TLSv1.3	1395	Application Data, Application Data
289	15.705821	192.168.43.245	185.166.104.4	TCP	54	5003 → 443 [ACK] Seq=3487 Ack=223860 Win=131584 Len=0
304	27.081204	192.168.43.245	185.166.104.4	TLSv1.3	436	Application Data
305	27.081276	192.168.43.245	185.166.104.4	TLSv1.3	93	Application Data
306	27.138442	185.166.104.4	192.168.43.245	TLSv1.3	93	Application Data
307	27.138442	185.166.104.4	192.168.43.245	TCP	54	443 → 5003 [ACK] Seq=223860 Ack=3908 Win=42496 Len=0
308	27.138558	192.168.43.245	185.166.104.4	TCP	54	5003 → 443 [ACK] Seq=3908 Ack=223899 Win=131328 Len=0
309	27.444327	185.166.104.4	192.168.43.245	TLSv1.3	367	Application Data
310	27.444848	192.168.43.245	185.166.104.4	TLSv1.3	89	Application Data
311	27.525019	185.166.104.4	192.168.43.245	TCP	54	443 → 5003 [ACK] Seq=224212 Ack=3943 Win=42496 Len=0
333	28.504402	192.168.43.245	185.166.104.4	TLSv1.3	134	Application Data
334	28.547900	185.166.104.4	192.168.43.245	TCP	54	443 → 5003 [ACK] Seq=224212 Ack=4023 Win=42496 Len=0
335	28.564606	185.166.104.4	192.168.43.245	TLSv1.3	326	Application Data
336	28.619650	192.168.43.245	185.166.104.4	TCP	54	5003 → 443 [ACK] Seq=4023 Ack=224484 Win=130816 Len=0
337	29.115822	192.168.43.245	185.166.104.4	TLSv1.3	127	Application Data
338	29.119182	192.168.43.245	185.166.104.4	TLSv1.3	128	Application Data
339	29.178859	185.166.104.4	192.168.43.245	TCP	54	443 → 5003 [ACK] Seq=224484 Ack=4170 Win=42496 Len=0
340	29.699569	185.166.104.4	192.168.43.245	TCP	1454	443 → 5003 [ACK] Seq=224484 Ack=4170 Win=42496 Len=1400 [TCP PDU reassembled in 342]
341	29.699569	185.166.104.4	192.168.43.245	TCP	1454	443 → 5003 [PSH, ACK] Seq=225884 Ack=4170 Win=42496 Len=1400 [TCP PDU reassembled in 342]
342	29.699569	185.166.104.4	192.168.43.245	TLSv1.3	1372	Application Data
343	29.699640	192.168.43.245	185.166.104.4	TCP	54	5003 → 443 [ACK] Seq=4170 Ack=228602 Win=131584 Len=0
344	29.701020	185.166.104.4	192.168.43.245	TCP	1454	443 → 5003 [ACK] Seq=228602 Ack=4170 Win=42496 Len=1400 [TCP PDU reassembled in 345]
345	29.701020	185.166.104.4	192.168.43.245	TLSv1.3	357	Application Data
346	29.701062	192.168.43.245	185.166.104.4	TCP	54	5003 → 443 [ACK] Seq=4170 Ack=230305 Win=131584 Len=0
347	29.701866	185.166.104.4	192.168.43.245	TLSv1.3	85	Application Data
348	29.701899	192.168.43.245	185.166.104.4	TCP	54	5003 → 443 [ACK] Seq=4170 Ack=230336 Win=131328 Len=0
349	29.715744	185.166.104.4	192.168.43.245	TLSv1.3	705	Application Data
350	29.720171	192.168.43.245	185.166.104.4	TLSv1.3	134	Application Data
351	29.802655	185.166.104.4	192.168.43.245	TCP	1454	443 → 5003 [ACK] Seq=230987 Ack=4250 Win=42496 Len=1400 [TCP PDU reassembled in 354]
352	29.802655	185.166.104.4	192.168.43.245	TCP	1454	443 → 5003 [PSH, ACK] Seq=232387 Ack=4250 Win=42496 Len=1400 [TCP PDU reassembled in 354]
353	29.802817	192.168.43.245	185.166.104.4	TCP	54	5003 → 443 [ACK] Seq=4250 Ack=233787 Win=131584 Len=0
354	29.804070	185.166.104.4	192.168.43.245	TLSv1.3	1372	Application Data
355	29.804315	185.166.104.4	192.168.43.245	TCP	1454	443 → 5003 [ACK] Seq=235105 Ack=4250 Win=42496 Len=1400 [TCP PDU reassembled in 358]
356	29.804392	192.168.43.245	185.166.104.4	TCP	54	5003 → 443 [ACK] Seq=4250 Ack=236505 Win=131584 Len=0
357	29.805069	185.166.104.4	192.168.43.245	TCP	1454	443 → 5003 [PSH, ACK] Seq=236505 Ack=4250 Win=42496 Len=1400 [TCP PDU reassembled in 358]
358	29.805213	185.166.104.4	192.168.43.245	TLSv1.3	1395	Application Data, Application Data
359	29.805275	192.168.43.245	185.166.104.4	TCP	54	5003 → 443 [ACK] Seq=4250 Ack=239246 Win=131584 Len=0
511	74.818082	192.168.43.245	185.166.104.4	TCP	55	[TCP Keep-Alive] 5003 → 443 [ACK] Seq=4249 Ack=239246 Win=131584 Len=1
513	75.090611	185.166.104.4	192.168.43.245	TCP	66	[TCP Keep-Alive ACK] 443 → 5003 [ACK] Seq=239246 Ack=4250 Win=42496 Len=0 SLE=4249 SRE=4250
522	89.790327	185.166.104.4	192.168.43.245	TLSv1.3	93	Application Data
523	89.790327	185.166.104.4	192.168.43.245	TLSv1.3	78	Application Data
524	89.790496	192.168.43.245	185.166.104.4	TCP	54	5003 → 443 [ACK] Seq=4250 Ack=239309 Win=131328 Len=0
525	89.790837	192.168.43.245	185.166.104.4	TCP	54	5003 → 443 [FIN, ACK] Seq=4250 Ack=239309 Win=131328 Len=0
526	89.790932	185.166.104.4	192.168.43.245	TCP	54	443 → 5003 [FIN, ACK] Seq=239309 Ack=4250 Win=42496 Len=0
527	89.791023	192.168.43.245	185.166.104.4	TCP	54	5003 → 443 [ACK] Seq=4251 Ack=239310 Win=131328 Len=0
529	89.817763	185.166.104.4	192.168.43.245	TCP	54	443 → 5003 [ACK] Seq=239310 Ack=4251 Win=42496 Len=0